Year,group  ,date,Site,Habitat,replicate,Sample unit,IpacL,IpacN,IpacA,DermL,Dermacentor nymph,Dermacenter adult,juvenile I.pac,Notes
2026,Group 4 / Vector? I Barely Know Her!,4/1/2026,Filoli,Redwood,1,30meter^2,2,1,0,0,0,0,3,East of Spring Creek
2026,Group 4 / Vector? I Barely Know Her!,4/1/2026,Filoli,Redwood,2,30meter^2,0,1,0,0,0,0,1,West of Spring Creek
2026,Group 4 / Vector? I Barely Know Her!,4/1/2026,Filoli,Oak,1,30meter^2,1,0,2,0,0,1,1,Under the big oak tree next to Red's Barn
2026,Group 4 / Vector? I Barely Know Her!,4/15/2026,Filoli,Oak,2,30meter^2,27,2,0,0,0,0,29,Near the entrance trails (west)
2026,Group 4 / Vector? I Barely Know Her!,4/15/2026,Filoli,Oak,3,30meter^2,20,3,0,0,0,0,23,Near the entrance (east; near the mulch piles); it was windy
2026,Group 4 / Vector? I Barely Know Her!,4/15/2026,Filoli,Redwood,3,30meter^2,5,2,1,0,0,0,7,South of barn